<?xml version="1.0" encoding="ISO-8859-1"?>
<!DOCTYPE math4u2 PUBLIC "-//FH Augsburg//DTD Math4u2//DE" "http://www.math4u2.de/xml/dtd/math4u2DTD.dtd">
<math4u2>
	<head>
		<version>2.0</version>
		<author>Dr. M. Weiss</author>
		<module id="main" class="ShowMeGraph"/>
	</head>
	<body>
		<location>Geometrie/Kurven/Kubische Kurven</location>
		<title>kubische B-Splines - kurz</title>
		<summary>Experimente mit uniformen nichtrationalen kubischen B-Splines.</summary>
		<keywords>
			<keyword>Spline</keyword>
			<keyword>B-Spline</keyword>
			<keyword>uniform</keyword>
			<keyword>nichtrational</keyword>
			<keyword>Gewichtsfunktion</keyword>
			<keyword>Basisfunktion</keyword>
		</keywords>
		<step>
			<title>Uniforme nichtrationale kubische B-Splines</title>
			<description>
				<strong>links</strong>: Zeit über Doppelpfeil t verändern.
				<br/><strong>rechts</strong>: Steuerpunkte bewegen.</description>
			<layout>
				<row perc="100">
					<col perc="50" name="gewichte"/>
					<col perc="50" name="kurven"/>
				</row>
			</layout>
			<seq>
				<script>
		      deleteAll();
					kurven.coordinateSystem(xMin=0.5;xMax=10;yMin=1;yMax=8);	
					kurven.setTitle( title = "Kurve");
					gewichte.coordinateSystem(xMin=-1.51;xMax=2.51;yMin=-0.5;yMax=1.5);					
					gewichte.setTitle( title = "Gewichtsfunktionen");
										
					expand( left = false; right = false );
					newObject( def = t:=punkt( 0.2, fix(-0.35)); color = magenta;style =  ARROW_H; target = gewichte);
					newObject( def = tg := gerade( t, e2y); linestyle = dot; target = gewichte );
					newObject( def = p0:=punkt(1, 6); target = kurven; );
					newObject( def = p1:=punkt(4, 4.2); colr = red; target = kurven; );
					newObject( def = p2:=punkt(2, 2.2); color = blue; target = kurven; );
					newObject( def = p3:=punkt(6.37, 2.2); color = green; target = kurven; );
					newObject( def = p4:=punkt(7, 5.3); color = orange; target = kurven; );
					newObject( def = p5:=punkt(8.6, 4.5); color = gray; target = kurven; );
					newObject( def = pp:=&lt;punkt>liste0({p0, p1,p2,p3,p4,p5}); );
					newObject( def = g1(t):=1/6*(1-t)^3 );
					newObject( def = g2(t):=1/6*(3*t^3-6*t^2+4) );
					newObject( def = g3(t):=1/6*(-3*t^3+3*t^2+3*t+1));
					newObject( def = g4(t):=1/6*t^3 );					
					newObject( def =gg4(t) := t^3/6 );
					newObject( def = gg3(t) := (-t^3+t^2+t+1/3)/2);
					newObject( def = gg2(t) := (3*t^3-6*t^2+4)/6);
					newObject( def =gg1(t) := (1-t)^3/6 );


					newObject( def = polx(i,t) := pp[i-1].x*gg1(t)+pp[i].x*gg2(t)+pp[i+1].x*gg3(t)+pp[i+2].x*gg4(t) );
					newObject( def = poly(i,t) := pp[i-1].y*gg1(t)+pp[i].y*gg2(t)+pp[i+1].y*gg3(t)+pp[i+2].y*gg4(t) );
					newObject( def =py(t) := p1.y*g1( t)+p2.y*g2( t)+p3.y*g3( t)+p4.y*g4( t) );
					newObject( def = px(t) := p1.x*g1( t)+p2.x*g2( t)+p3.x*g3( t)+p4.x*g4( t));
										newObject( def = mark0:=marker(px(0), py(0) ); target = kurven );
					newObject( def = mark1:=marker(px(1), py(1) ); target = kurven );
					newObject( def =spline1:=kurve(t,0,1,polx(1,t),poly(1,t)); linestyle = dot;  target = kurven );
					newObject( def =spline2:=kurve(t,0,1,polx(2,t),poly(2,t)); target = kurven );
					newObject( def =spline3:=kurve(t,0,1,polx(3,t),poly(3,t)); linestyle = dash; target = kurven );
					

		      
					
					newObject( def = flaecheLinks:= flaeche({punkt(-1, 0), punkt(0,0), punkt(0, 10), punkt(-1, 10 )}); fillcolor = 100.100.100.100;  target = gewichte );
					newObject( def = flaecheRechts:= flaeche({punkt(1, 0), punkt(2,0), punkt(2, 10), punkt(1, 10 )}); fillcolor = 100.100.100.100; target = gewichte );
					newObject( def = streckeLinks := strecke( punkt(-1, -0.2), punkt(0,-0.2) ) ; linestyle = dot; target = gewichte );
					newObject( def = streckeMitte := strecke( punkt(0, -0.2), punkt(1,-0.2) ) ; target = gewichte );
					newObject( def = streckeRechts := strecke( punkt(1, -0.2), punkt(2,-0.2) ) ; linestyle = dash; target = gewichte );
					
					newObject( def = m10:= marker( -0.875, 1.1); color = black; target = gewichte );
					newObject( def = m11:= marker( -0.625, 1.1); color =red; target = gewichte );
					newObject( def = m12:= marker( -0.375, 1.1); color = blue; target = gewichte );
					newObject( def = m13:= marker( -0.125, 1.1); color = green; target = gewichte );
					
					
					newObject( def = m21:= marker( 0.125, 1.1); color =red; target = gewichte );
					newObject( def = m22:= marker( 0.375, 1.1); color = blue; target = gewichte );
					newObject( def = m23:= marker( 0.625, 1.1); color = green; target = gewichte );
					newObject( def = m24:= marker( 0.875, 1.1); color = orange; target = gewichte );
					
					newObject( def = m32:= marker( 1.125, 1.1); color = blue; target = gewichte );
					newObject( def = m33:= marker( 1.375, 1.1); color = green; target = gewichte );
					newObject( def = m34:= marker( 1.625, 1.1); color = orange; target = gewichte );
					newObject( def = m35:= marker( 1.875, 1.1); color =gray; target = gewichte );


					
					newObject( def = tt :=t.x );
		         newObject( def = kind := ceil(tt)+1 );
		         newObject( def = km := marker(polx(kind,tt+2-kind), poly(kind,tt+2-kind)); color = magenta; target = kurven );

		         newObject( def = g14:=kurve(t,-1,0,t ,0); color = orange;  target = gewichte );
		       newObject( def = g24:=kurve(t,0,1,t ,g4(t)); color = orange; target = gewichte );



                  		      newObject( def = g21:=kurve(t,0,1,t ,g1(t)); color = red; target = gewichte );

                            	newObject( def = g32:=kurve(t,1,2,t ,g1(t-1)); color = blue; linestyle = dash; target = gewichte );
		     				

		          newObject( def = g22:=kurve(t,0,1,t ,g2(t)); color = blue; target = gewichte );
		                            newObject( def = g12:=kurve(t,-1,0,t ,g3(t+1)); color = blue; linestyle = dot; target = gewichte );
		                            newObject( def = g23:=kurve(t,0,1,t ,g3(t)); color = green; target = gewichte );



		     
					
					
					
					newObject( def = g10:=kurve(t,-1,0,t ,g1(t+1)); linestyle = dot; target = gewichte );
					newObject( def = g11:=kurve(t,-1,0,t ,g2(t+1)); color = red; linestyle = dot; target = gewichte );

					newObject( def = g13:=kurve(t,-1,0,t ,g4(t+1)); color = green; linestyle = dot; target = gewichte );

					newObject( def = g33:=kurve(t,1,2,t ,g2(t-1)); color = green; linestyle = dash; target = gewichte );
					newObject( def = g34:=kurve(t,1,2,t ,g3(t-1)); color = orange; linestyle = dash; target = gewichte );
					newObject( def = g35:=kurve(t,1,2,t ,g4(t-1)); color = gray; linestyle = dash; target = gewichte );
					
					

		      </script>
			</seq>
		</step>
	</body>
</math4u2>
