<?xml version="1.0" encoding="ISO-8859-1"?>
<!DOCTYPE math4u2 PUBLIC "-//FH Augsburg//DTD Math4u2//DE" "http://www.math4u2.de/xml/dtd/math4u2DTD.dtd">
<math4u2>
	<head>
		<version>2.0</version>
		<author>Stefan Fenn, Erich Seifert, Prof. Dr. Maximilian Weiﬂ</author>
		<module id="main" class="ShowMeGraph"/>
	</head>
	<body>
		<location>2. Bedienung</location>
		<title>2.0 Bedienung</title>
		<step>
			<title>2 Bedienung</title>
			<description>
Hier finden sie Details zur Bedienung von math4u2.
<br/>Einen kurzen Einblick in die wichtigsten Bedienkonzepte 
gibt der Abschnitt 1.2 des Kapitels 1.
			</description>
		</step>
	</body>
</math4u2>
