<?xml version="1.0" encoding="ISO-8859-1"?>
<!DOCTYPE math4u2 PUBLIC "-//FH Augsburg//DTD Math4u2//DE" "http://www.math4u2.de/xml/dtd/math4u2DTD.dtd">
<math4u2>
	<head>
		<version>2.0</version>
		<author>Stefan Fenn, Erich Seifert, Prof. Dr. Maximilian Weiß</author>
		<module id="main" class="ShowMeGraph"/>
	</head>
	<body>
		<location>3. Daten, Funktionen, Objekte, Graphen/3.3 Funktionen</location>
		<title>3.3.6 Partielle Ableitung</title>
		<step>
			<title>3.3.6 Partielle Ableitung</title>
			<description>			
Mehrstellige Funktionen können partiell abgeleitet werden.
<br/>Mit <code>d(x,y):=pderive(x*y*sin(y), x, y, y)</code> wird <code>d(x,y)</code> als partielle 
Ableitung dritter Ordnung der Funktion <code>x*y*sin(y)</code> definiert, dabei wird zuerst nach 
der Variablen <code>x</code> differenziert, anschließend zweimal nach der Variablen <code>y</code>.
<p/>Wenn eine partielle Ableitung im Rahmen der Definition einer weiteren Funktion verwendet werden
soll, so geschieht dies wie bei
<br/><code>g(z):=z+pderive(vars(x,y), y*sin(x*y), y, y, x)(z, 2)</code>.
<p/>
Die einzelnen Bestandteile bedeuten:
<ul>
	<li>
Mit <code>vars(x, y)</code> bedeutet, dass <code>x</code> die erste Variable und <code>y</code>
die zweite Variable ist. Der Ableitung liegen diese beiden Variablen zugrunde.
	</li>
	<li>
Der Term <code>y*sin(x*y)</code> ist der Funktionsterm der abzuleitenden Funktion.
	</li>
	<li>
Differenziert wird zuerst zweimal nach <code>y</code>, dann einmal nach <code>x</code>.
	</li>
	<li>
In der entstehenden Funktion wie die (erste) Variable <code>x</code> durch die Variable der 
Funktion <code>g(z)</code> substituiert, die (zweite) Variable <code>y</code> durch die 
Zahl <code>2</code>.		
	</li>
</ul>
			</description>
		</step>
	</body>
</math4u2>