<?xml version="1.0" encoding="ISO-8859-1"?>
<!DOCTYPE math4u2 PUBLIC "-//FH Augsburg//DTD Math4u2//DE" "http://www.math4u2.de/xml/dtd/math4u2DTD.dtd">
<math4u2>
	<head>
		<version>2.0</version>
		<author>unknown</author>
		<module id="main" class="ShowMeGraph"/>
	</head>
	<body>
		<location>Vorlagen/Zeichenflächen</location>
		<title>1. Eine Zeichenfläche</title>
		<summary>Vorlage für eine Zeichenfläche</summary>
		<step>
			<seq>
				<script>
				</script>
			</seq>
		</step>
	</body>
</math4u2>
