<?xml version="1.0" encoding="ISO-8859-1"?>
<!DOCTYPE math4u2 PUBLIC "-//FH Augsburg//DTD Math4u2//DE" "http://www.math4u2.de/xml/dtd/math4u2DTD.dtd">
<math4u2>
	<head>
		<version>2.0</version>
		<author>Stefan Fenn, Erich Seifert, Prof. Dr. Maximilian Weiﬂ</author>
		<module id="main" class="ShowMeGraph"/>
	</head>
	<body>
		<location>2. Bedienung</location>
		<title>2.1.5 Lektionen-Fenster</title>
		<step>
			<title>2.1.5 Lektionen-Fenster</title>
			<description>
Mehr dazu im Abschnitt 2.6 dieses Kapitels.
			</description>
		</step>
	</body>
</math4u2>
