<?xml version="1.0" encoding="ISO-8859-1"?>
<!DOCTYPE math4u2 PUBLIC "-//FH Augsburg//DTD Math4u2//DE" "http://www.math4u2.de/xml/dtd/math4u2DTD.dtd">
<math4u2>
	<head>
		<version>2.0</version>
		<author>Stefan Fenn, Erich Seifert, Prof. Dr. Maximilian Weiß</author>
		<module id="main" class="ShowMeGraph"/>
	</head>
	<body>
		<location>3. Daten, Funktionen, Objekte, Graphen/3.4 Affine Objekte</location>
		<title>3.4.10 Fläche</title>
		<step>
			<title>3.4.10 Fläche</title>
			<description>
Die Regeln bei der Definition einer Fläche sind zunächst die gleichen wie die bei einem Kurvenzug.
Zusätzlich wird der Endpunkt des letzten Elements mit dem Startpunkt des ersten Elements durch eine
Strecke verbunden (falls diese Punkte nicht identisch sind). Beim Zeichnen wird die so eingeschlossene
Fläche mit der gewählten Farbe ausgefüllt.	

<p/><strong>Fläche definieren</strong>
<br/><code>dreieck:=flaeche({ punkt(0,0), punkt(4,-1), punkt(3,7) })</code>
<br/>definiert ein Dreieck.
<p/>Ansonsten gelten die gleichen Regeln wie bei einem Kurvenzug.						
			</description>
		</step>
	</body>
</math4u2>